,Actors,Awards,BoxOffice,Country,DVD,Director,Error,Genre,Language,Metascore,Plot,Poster,Production,Rated,Ratings,Released,Response,Runtime,Title,Type,Website,Writer,Year,imdbID,imdbRating,imdbVotes,totalSeasons
188,"Alon Aboutboul, Waleed Zuaiter, Adel Bencherif, Mehdi Dehbi",1 win & 2 nominations.,N/A,"UK, Bulgaria, USA",14 Jun 2016,Babak Najafi,,"Action, Thriller","English, Italian, French, Japanese",28,"In London for the Prime Minister's funeral, Mike Banning is caught up in a plot to assassinate all the attending world leaders.",https://m.media-amazon.com/images/M/MV5BMTY1ODY2MTgwM15BMl5BanBnXkFtZTgwOTY3Nzc3NzE@._V1_SX300.jpg,Focus Features,R,"[{'Source': 'Internet Movie Database', 'Value': '5.9/10'}, {'Source': 'Rotten Tomatoes', 'Value': '26%'}, {'Source': 'Metacritic', 'Value': '28/100'}]",04 Mar 2016,True,99 min,London Has Fallen,movie,http://www.londonhasfallen.com/,"Creighton Rothenberger (based on characters created by), Katrin Benedikt (based on characters created by), Creighton Rothenberger (story by), Katrin Benedikt (story by), Creighton Rothenberger (screenplay by), Katrin Benedikt (screenplay by), Christian Gudegast (screenplay by), Chad St. John (screenplay by)",2016,tt3300542,5.9,"122,811",
189,"Amy Adams, Jeremy Renner, Forest Whitaker, Michael Stuhlbarg",Won 1 Oscar. Another 64 wins & 251 nominations.,"$100,501,349",USA,14 Feb 2017,Denis Villeneuve,,"Drama, Mystery, Sci-Fi, Thriller","English, Russian, Mandarin",81,A linguist is recruited by the military to communicate with alien lifeforms after twelve mysterious spacecrafts land around the world.,https://m.media-amazon.com/images/M/MV5BMTExMzU0ODcxNDheQTJeQWpwZ15BbWU4MDE1OTI4MzAy._V1_SX300.jpg,21 Laps Entertainment,PG-13,"[{'Source': 'Internet Movie Database', 'Value': '7.9/10'}, {'Source': 'Rotten Tomatoes', 'Value': '94%'}, {'Source': 'Metacritic', 'Value': '81/100'}]",11 Nov 2016,True,116 min,Arrival,movie,http://www.arrivalmovie.com/,"Eric Heisserer (screenplay by), Ted Chiang (based on the story ""Story of Your Life"" written by)",2016,tt2543164,7.9,"503,142",
190,"Mila Kunis, Kathryn Hahn, Kristen Bell, Christina Applegate",3 wins & 5 nominations.,"$113,217,955",USA,01 Nov 2016,"Jon Lucas, Scott Moore",,Comedy,English,60,"When three overworked and under-appreciated moms are pushed beyond their limits, they ditch their conventional responsibilities for a jolt of long overdue freedom, fun and comedic self-indulgence.",https://m.media-amazon.com/images/M/MV5BMjIwNzE5MTgwNl5BMl5BanBnXkFtZTgwNjM4OTA0OTE@._V1_SX300.jpg,Block Entertainment,R,"[{'Source': 'Internet Movie Database', 'Value': '6.2/10'}, {'Source': 'Rotten Tomatoes', 'Value': '58%'}, {'Source': 'Metacritic', 'Value': '60/100'}]",29 Jul 2016,True,100 min,Bad Moms,movie,http://stxmovies.com/badmoms/,"Jon Lucas, Scott Moore",2016,tt4651520,6.2,"98,803",
191,"Andy Samberg, Katie Crown, Kelsey Grammer, Jennifer Aniston",3 wins & 3 nominations.,"$72,655,779",USA,20 Dec 2016,"Nicholas Stoller, Doug Sweetland",,"Animation, Adventure, Comedy, Family, Fantasy",English,56,"Storks have moved on from delivering babies to packages. But when an order for a baby appears, the best delivery stork must scramble to fix the error by delivering the baby.",https://m.media-amazon.com/images/M/MV5BMTYxNjI3MzcwMF5BMl5BanBnXkFtZTgwOTIyNDY5OTE@._V1_SX300.jpg,Warner Bros. Pictures,PG,"[{'Source': 'Internet Movie Database', 'Value': '6.8/10'}, {'Source': 'Rotten Tomatoes', 'Value': '65%'}, {'Source': 'Metacritic', 'Value': '56/100'}]",23 Sep 2016,True,87 min,Storks,movie,http://www.storksmovie.com/,Nicholas Stoller,2016,tt4624424,6.8,"49,566",
192,"Mark Rylance, Ruby Barnhill, Penelope Wilton, Jemaine Clement",4 wins & 20 nominations.,"$55,472,665","USA, India",29 Nov 2016,Steven Spielberg,,"Adventure, Family, Fantasy",English,66,"An orphan little girl befriends a benevolent giant who takes her to Giant Country, where they attempt to stop the man-eating giants that are invading the human world.",https://m.media-amazon.com/images/M/MV5BNjAzOTUzNTY3Ml5BMl5BanBnXkFtZTgwMjYwNzE5ODE@._V1_SX300.jpg,Walt Disney Pictures,PG,"[{'Source': 'Internet Movie Database', 'Value': '6.4/10'}, {'Source': 'Rotten Tomatoes', 'Value': '75%'}, {'Source': 'Metacritic', 'Value': '66/100'}]",01 Jul 2016,True,117 min,The BFG,movie,http://movies.disney.com/the-bfg,"Melissa Mathison (screenplay by), Roald Dahl (based on the book by)",2016,tt3691740,6.4,"68,041",
193,"Andrew Garfield, Richard Pyros, Jacob Warner, Milo Gibson",Won 2 Oscars. Another 46 wins & 111 nominations.,"$67,115,062","Australia, USA",21 Feb 2017,Mel Gibson,,"Biography, Drama, History, War","English, Japanese",71,"World War II American Army Medic Desmond T. Doss, who served during the Battle of Okinawa, refuses to kill people, and becomes the first man in American history to receive the Medal of Honor without firing a shot.",https://m.media-amazon.com/images/M/MV5BMjQ1NjM3MTUxNV5BMl5BanBnXkFtZTgwMDc5MTY5OTE@._V1_SX300.jpg,Summit Entertainment,R,"[{'Source': 'Internet Movie Database', 'Value': '8.1/10'}, {'Source': 'Rotten Tomatoes', 'Value': '86%'}, {'Source': 'Metacritic', 'Value': '71/100'}]",04 Nov 2016,True,139 min,Hacksaw Ridge,movie,http://www.hacksawridge.movie/,"Robert Schenkkan (screenplay by), Andrew Knight (screenplay by)",2016,tt2119532,8.1,"355,491",
194,"Chris Hemsworth, Charlize Theron, Jessica Chastain, Emily Blunt",16 nominations.,"$46,445,229","USA, China",23 Aug 2016,Cedric Nicolas-Troyan,,"Action, Adventure, Drama, Fantasy",English,35,"Eric and fellow warrior Sara, raised as members of ice Queen Freya's army, try to conceal their forbidden love as they fight to survive the wicked intentions of both Freya and her sister Ravenna.",https://m.media-amazon.com/images/M/MV5BMmI5ZjBjZmMtNTQwOC00YWJjLThkNmUtOTY2ZDkwMmI2ZmU4XkEyXkFqcGdeQXVyMTQ1ODEyNjA@._V1_SX300.jpg,Universal Pictures,PG-13,"[{'Source': 'Internet Movie Database', 'Value': '6.1/10'}, {'Source': 'Rotten Tomatoes', 'Value': '17%'}, {'Source': 'Metacritic', 'Value': '35/100'}]",22 Apr 2016,True,114 min,The Huntsman: Winter's War,movie,https://www.facebook.com/thehuntsmanmovie,"Evan Spiliotopoulos, Craig Mazin, Evan Daugherty (characters)",2016,tt2381991,6.1,"85,986",
195,"Tom Cruise, Cobie Smulders, Aldis Hodge, Danika Yarosh",1 win.,"$58,676,235","China, USA",31 Jan 2017,Edward Zwick,,"Action, Thriller","English, Ukrainian",47,"Jack Reacher must uncover the truth behind a major government conspiracy in order to clear his name. On the run as a fugitive from the law, Reacher uncovers a potential secret from his past that could change his life forever.",https://m.media-amazon.com/images/M/MV5BODQ3ODQ3NDI4NV5BMl5BanBnXkFtZTgwMDY1Mzk5OTE@._V1_SX300.jpg,Paramount Pictures,PG-13,"[{'Source': 'Internet Movie Database', 'Value': '6.1/10'}, {'Source': 'Rotten Tomatoes', 'Value': '38%'}, {'Source': 'Metacritic', 'Value': '47/100'}]",21 Oct 2016,True,118 min,Jack Reacher: Never Go Back,movie,http://www.ReacherMovie.com,"Richard Wenk (screenplay), Edward Zwick (screenplay), Marshall Herskovitz (screenplay), Lee Child (book)",2016,tt3393786,6.1,"118,840",
196,"Stephen Lang, Jane Levy, Dylan Minnette, Daniel Zovatto",7 wins & 21 nominations.,"$89,210,468",USA,29 Nov 2016,Fede Alvarez,,"Crime, Horror, Thriller",English,71,"Hoping to walk away with a massive fortune, a trio of thieves break into the house of a blind man who isn't as helpless as he seems.",https://m.media-amazon.com/images/M/MV5BZGI5ZTU2M2YtZWY4MC00ZDFhLTliYTItZTk1NjdlN2NkMzg2XkEyXkFqcGdeQXVyMjY5ODI4NDk@._V1_SX300.jpg,Ghost House Pictures,R,"[{'Source': 'Internet Movie Database', 'Value': '7.1/10'}, {'Source': 'Rotten Tomatoes', 'Value': '88%'}, {'Source': 'Metacritic', 'Value': '71/100'}]",26 Aug 2016,True,88 min,Don't Breathe,movie,http://www.dontbreathe-movie.com/site/,"Fede Alvarez, Rodo Sayagues",2016,tt4160708,7.1,"181,775",
197,"Ben Affleck, Anna Kendrick, J.K. Simmons, Jon Bernthal",3 wins & 5 nominations.,"$86,198,014",USA,10 Jan 2017,Gavin O'Connor,,"Action, Crime, Drama, Thriller","English, Indonesian, French",51,"As a math savant uncooks the books for a new client, the Treasury Department closes in on his activities, and the body count starts to rise.",https://m.media-amazon.com/images/M/MV5BNjFmN2UwYWEtMmNiNi00YTU5LThiM2YtMmU4YzYzYTA3YWFjXkEyXkFqcGdeQXVyNzQ1ODk3MTQ@._V1_SX300.jpg,Warner Bros. Pictures,R,"[{'Source': 'Internet Movie Database', 'Value': '7.3/10'}, {'Source': 'Rotten Tomatoes', 'Value': '51%'}, {'Source': 'Metacritic', 'Value': '51/100'}]",14 Oct 2016,True,128 min,The Accountant,movie,http://www.accountantmovie.com/,Bill Dubuque,2016,tt2140479,7.3,"228,495",
198,"Brenton Thwaites, John Samaha, Courtney Eaton, Nikolaj Coster-Waldau",2 wins & 14 nominations.,"$31,141,074","USA, Australia, China",31 May 2016,Alex Proyas,,"Action, Adventure, Fantasy",English,25,"Mortal hero Bek teams with the god Horus in an alliance against Set, the merciless god of darkness, who has usurped Egypt's throne, plunging the once peaceful and prosperous empire into chaos and conflict.",https://m.media-amazon.com/images/M/MV5BNjExODg3MDUzNl5BMl5BanBnXkFtZTgwNjExMjE3NzE@._V1_SX300.jpg,Lionsgate,PG-13,"[{'Source': 'Internet Movie Database', 'Value': '5.4/10'}, {'Source': 'Rotten Tomatoes', 'Value': '15%'}, {'Source': 'Metacritic', 'Value': '25/100'}]",26 Feb 2016,True,127 min,Gods of Egypt,movie,http://www.godsofegypt.movie/home,"Matt Sazama, Burk Sharpless",2016,tt2404233,5.4,"93,371",
199,"Teresa Palmer, Gabriel Bateman, Alexander DiPersia, Billy Burke",3 wins & 9 nominations.,"$67,235,683",USA,25 Oct 2016,David F. Sandberg,,"Drama, Horror, Mystery, Thriller",English,58,"Rebecca must unlock the terror behind her little brother's experiences that once tested her sanity, bringing her face to face with a supernatural spirit attached to their mother.",https://m.media-amazon.com/images/M/MV5BMTg1OTkxNDgyMV5BMl5BanBnXkFtZTgwMjEzNTc0ODE@._V1_SX300.jpg,RatPac-Dune Entertainment,PG-13,"[{'Source': 'Internet Movie Database', 'Value': '6.3/10'}, {'Source': 'Rotten Tomatoes', 'Value': '77%'}, {'Source': 'Metacritic', 'Value': '58/100'}]",22 Jul 2016,True,81 min,Lights Out,movie,http://www.lightsoutmovie.com/,"Eric Heisserer (screenplay), David F. Sandberg (based on the short film by)",2016,tt4786282,6.3,"98,326",
200,"Alistair Abell, Iris Apatow, Sugar Lyn Beard, Michael Cera",1 win & 24 nominations.,"$97,661,826",USA,08 Nov 2016,"Greg Tiernan, Conrad Vernon",,"Animation, Adventure, Comedy, Fantasy",English,66,A sausage strives to discover the truth about his existence.,https://m.media-amazon.com/images/M/MV5BMjkxOTk1MzY4MF5BMl5BanBnXkFtZTgwODQzOTU5ODE@._V1_SX300.jpg,Sony Pictures,R,"[{'Source': 'Internet Movie Database', 'Value': '6.2/10'}, {'Source': 'Rotten Tomatoes', 'Value': '83%'}, {'Source': 'Metacritic', 'Value': '66/100'}]",12 Aug 2016,True,89 min,Sausage Party,movie,http://www.sausagepartymovie.com/site/,"Kyle Hunter (screenplay by), Ariel Shaffir (screenplay by), Seth Rogen (screenplay by), Evan Goldberg (screenplay by), Seth Rogen (story by), Evan Goldberg (story by), Jonah Hill (story by)",2016,tt1700841,6.2,"156,193",
201,"Sunny Pawar, Abhishek Bharate, Priyanka Bose, Khushi Solanki",Nominated for 6 Oscars. Another 49 wins & 80 nominations.,"$51,694,854","UK, Australia, USA",11 Apr 2017,Garth Davis,,"Biography, Drama","English, Hindi, Bengali",69,"A five-year-old Indian boy gets lost on the streets of Calcutta, thousands of kilometers from home. He survives many challenges before being adopted by a couple in Australia. 25 years later, he sets out to find his lost family.",https://m.media-amazon.com/images/M/MV5BMjA3NjkzNjg2MF5BMl5BanBnXkFtZTgwMDkyMzgzMDI@._V1_SX300.jpg,See-Saw Films,PG-13,"[{'Source': 'Internet Movie Database', 'Value': '8.1/10'}, {'Source': 'Rotten Tomatoes', 'Value': '85%'}, {'Source': 'Metacritic', 'Value': '69/100'}]",06 Jan 2017,True,118 min,Lion,movie,http://lionmovie.com/,"Saroo Brierley (adapted from the book ""A Long Way Home"" by), Luke Davies (screenplay by)",2016,tt3741834,8.1,"177,416",
202,"Ice Cube, Kevin Hart, Tika Sumpter, Benjamin Bratt",1 win & 7 nominations.,N/A,USA,26 Apr 2016,Tim Story,,"Action, Comedy",English,32,"As his wedding day approaches, Ben heads to Miami with his soon-to-be brother-in-law James to bring down a drug dealer who's supplying the dealers of Atlanta with product.",https://m.media-amazon.com/images/M/MV5BMTU4ODAzMzcxOV5BMl5BanBnXkFtZTgwODkxMDI1NjE@._V1_SX300.jpg,Universal Pictures,PG-13,"[{'Source': 'Internet Movie Database', 'Value': '5.9/10'}, {'Source': 'Rotten Tomatoes', 'Value': '13%'}, {'Source': 'Metacritic', 'Value': '32/100'}]",15 Jan 2016,True,102 min,Ride Along 2,movie,http://www.ridealong.com/,"Phil Hay, Matt Manfredi, Greg Coolidge (characters)",2016,tt2869728,5.9,"47,665",
203,"Mark Wahlberg, Kurt Russell, Douglas M. Griffin, James DuMont",Nominated for 2 Oscars. Another 3 wins & 13 nominations.,"$73,098,411","Hong Kong, USA",10 Jan 2017,Peter Berg,,"Action, Drama, History, Thriller",English,68,"A dramatization of the disaster in April 2010, when the offshore drilling rig called the Deepwater Horizon exploded, resulting in the worst oil spill in American history.",https://m.media-amazon.com/images/M/MV5BOTEzNDU0OTgxM15BMl5BanBnXkFtZTgwNjA0ODM2OTE@._V1_SX300.jpg,Lionsgate,PG-13,"[{'Source': 'Internet Movie Database', 'Value': '7.1/10'}, {'Source': 'Rotten Tomatoes', 'Value': '83%'}, {'Source': 'Metacritic', 'Value': '68/100'}]",30 Sep 2016,True,107 min,Deepwater Horizon,movie,http://www.deepwaterhorizon.movie/,"Matthew Michael Carnahan (screenplay by), Matthew Sand (screenplay by), Matthew Sand (screen story), David Barstow (based upon an article by), David Rohde (based upon an article by), Stephanie Saul (based upon an article by)",2016,tt1860357,7.1,"130,410",
204,"Brad Pitt, Vincent Ebrahim, Xavier de Guillebon, Marion Cotillard",Nominated for 1 Oscar. Another 10 nominations.,"$40,069,087","UK, USA",28 Feb 2017,Robert Zemeckis,,"Action, Drama, Romance, Thriller, War","English, French, German, Arabic",60,"In 1942, a Canadian intelligence officer in North Africa encounters a female French Resistance fighter on a deadly mission behind enemy lines. When they reunite in London, their relationship is tested by the pressures of war.",https://m.media-amazon.com/images/M/MV5BZWEyMzg4ZWUtYmZhMC00Yjk2LWEyYjktODVmN2M3YTA2ZmNjXkEyXkFqcGdeQXVyNjQ2Mjg3OTI@._V1_SX300.jpg,Paramount Pictures,R,"[{'Source': 'Internet Movie Database', 'Value': '7.1/10'}, {'Source': 'Rotten Tomatoes', 'Value': '61%'}, {'Source': 'Metacritic', 'Value': '60/100'}]",23 Nov 2016,True,124 min,Allied,movie,http://www.alliedmovie.com/,Steven Knight,2016,tt3640424,7.1,"123,127",
205,"Blake Lively, Óscar Jaenada, Angelo Josue Lozano Corzo, Joseph Salas",15 nominations.,"$55,121,623",USA,27 Sep 2016,Jaume Collet-Serra,,"Drama, Horror, Thriller","English, Spanish",59,"A mere 200 yards from shore, surfer Nancy is attacked by a great white shark, with her short journey to safety becoming the ultimate contest of wills.",https://m.media-amazon.com/images/M/MV5BMjA1MTA4MzU4Ml5BMl5BanBnXkFtZTgwNjUxNjczODE@._V1_SX300.jpg,Ombra Films,PG-13,"[{'Source': 'Internet Movie Database', 'Value': '6.3/10'}, {'Source': 'Rotten Tomatoes', 'Value': '78%'}, {'Source': 'Metacritic', 'Value': '59/100'}]",24 Jun 2016,True,86 min,The Shallows,movie,http://www.theshallows-movie.com/site/,Anthony Jaswinski,2016,tt4052882,6.3,"104,154",
206,"Frank Grillo, Elizabeth Mitchell, Mykelti Williamson, Joseph Julian Soria",6 nominations.,N/A,"USA, Japan",04 Oct 2016,James DeMonaco,,"Action, Horror, Sci-Fi, Thriller","English, Russian, Afrikaans",55,"Former Police Sergeant Barnes becomes head of security for Senator Charlie Roan, a Presidential candidate targeted for death on Purge night due to her vow to eliminate the Purge.",https://m.media-amazon.com/images/M/MV5BMjMxNzk2OTQ1OV5BMl5BanBnXkFtZTgwMTI2NjU5ODE@._V1_SX300.jpg,Universal Pictures,R,"[{'Source': 'Internet Movie Database', 'Value': '6.0/10'}, {'Source': 'Rotten Tomatoes', 'Value': '54%'}, {'Source': 'Metacritic', 'Value': '55/100'}]",01 Jul 2016,True,108 min,The Purge: Election Year,movie,http://www.thepurgeelectionyear.com/,James DeMonaco,2016,tt4094724,6.0,"78,764",
207,"Zoey Deutch, James Franco, Tangie Ambrose, Cedric the Entertainer",1 win.,"$60,312,925","USA, Cambodia",28 Mar 2017,John Hamburg,,Comedy,"English, Khmer",39,A holiday gathering threatens to go off the rails when Ned Fleming realizes that his daughter's Silicon Valley millionaire boyfriend is about to pop the question.,https://m.media-amazon.com/images/M/MV5BNDlkMDQ1NzUtNGE3OC00NmUwLWI0NjAtNDJmODUzY2NhOGIzL2ltYWdlXkEyXkFqcGdeQXVyNDg2MjUxNjM@._V1_SX300.jpg,20th Century Fox,R,"[{'Source': 'Internet Movie Database', 'Value': '6.2/10'}, {'Source': 'Rotten Tomatoes', 'Value': '39%'}, {'Source': 'Metacritic', 'Value': '39/100'}]",23 Dec 2016,True,111 min,Why Him?,movie,http://www.foxmovies.com/movies/why-him,"John Hamburg (screenplay by), Ian Helfer (screenplay by), Jonah Hill (story by), John Hamburg (story by), Ian Helfer (story by)",2016,tt4501244,6.2,"88,135",
208,"Jason Bateman, Olivia Munn, T.J. Miller, Jennifer Aniston",1 win & 1 nomination.,"$54,730,514","USA, India",04 Apr 2017,"Josh Gordon, Will Speck",,Comedy,"English, Russian",42,"When his uptight CEO sister threatens to shut down his branch, the branch manager throws an epic Christmas party in order to land a big client and save the day, but the party gets way out of hand...",https://m.media-amazon.com/images/M/MV5BNTI2MDE5MjQ3MV5BMl5BanBnXkFtZTgwNjA0MTUzMDI@._V1_SX300.jpg,Paramount Pictures,R,"[{'Source': 'Internet Movie Database', 'Value': '5.8/10'}, {'Source': 'Rotten Tomatoes', 'Value': '41%'}, {'Source': 'Metacritic', 'Value': '42/100'}]",09 Dec 2016,True,105 min,Office Christmas Party,movie,N/A,"Jon Lucas (story by), Scott Moore (story by), Timothy Dowling (story by), Justin Malen (screenplay by), Laura Solon (screenplay by), Dan Mazer (screenplay by)",2016,tt1711525,5.8,"58,352",
209,"Dakota Johnson, Rebel Wilson, Leslie Mann, Damon Wayans Jr.",3 nominations.,N/A,USA,24 May 2016,Christian Ditter,,"Comedy, Drama, Romance",English,51,A group of young adults navigate love and relationships in New York City.,https://m.media-amazon.com/images/M/MV5BNzI4MDMwMzUwNF5BMl5BanBnXkFtZTgwMDgyNzkyNzE@._V1_SX300.jpg,Warner Bros. Pictures,R,"[{'Source': 'Internet Movie Database', 'Value': '6.1/10'}, {'Source': 'Rotten Tomatoes', 'Value': '46%'}, {'Source': 'Metacritic', 'Value': '51/100'}]",12 Feb 2016,True,110 min,How to Be Single,movie,http://howtobesinglemovie.com/,"Abby Kohn (screenplay), Marc Silverstein (screenplay), Dana Fox (screenplay), Abby Kohn (screen story), Marc Silverstein (screen story), Liz Tuccillo (book)",2016,tt1292566,6.1,"73,291",
210,"John Goodman, Mary Elizabeth Winstead, John Gallagher Jr., Douglas M. Griffin",13 wins & 45 nominations.,"$59,481,553",USA,14 Jun 2016,Dan Trachtenberg,,"Drama, Horror, Mystery, Sci-Fi, Thriller",English,76,"After getting in a car accident, a woman is held in a shelter with two men, who claim the outside world is affected by a widespread chemical attack.",https://m.media-amazon.com/images/M/MV5BMjEzMjczOTIxMV5BMl5BanBnXkFtZTgwOTUwMjI3NzE@._V1_SX300.jpg,Bad Robot Productions,PG-13,"[{'Source': 'Internet Movie Database', 'Value': '7.2/10'}, {'Source': 'Rotten Tomatoes', 'Value': '90%'}, {'Source': 'Metacritic', 'Value': '76/100'}]",11 Mar 2016,True,103 min,10 Cloverfield Lane,movie,http://www.10cloverfieldlane.com/,"Josh Campbell (screenplay by), Matthew Stuecken (screenplay by), Damien Chazelle (screenplay by), Josh Campbell (story by), Matthew Stuecken (story by)",2016,tt1179933,7.2,"256,103",
211,"Chloë Grace Moretz, Matthew Zuk, Gabriela Lopez, Bailey Anne Borders",1 nomination.,N/A,"USA, UK",03 May 2016,J Blakeson,,"Action, Adventure, Drama, Fantasy, Sci-Fi, Thriller",English,33,"Four waves of increasingly deadly alien attacks have left most of Earth decimated. Cassie is on the run, desperately trying to save her younger brother.",https://m.media-amazon.com/images/M/MV5BMjQwOTc0Mzg3Nl5BMl5BanBnXkFtZTgwOTg3NjI2NzE@._V1_SX300.jpg,Sony Pictures,PG-13,"[{'Source': 'Internet Movie Database', 'Value': '5.2/10'}, {'Source': 'Rotten Tomatoes', 'Value': '15%'}, {'Source': 'Metacritic', 'Value': '33/100'}]",22 Jan 2016,True,112 min,The 5th Wave,movie,http://www.laquintaola.com.mx/,"Susannah Grant (screenplay by), Akiva Goldsman (screenplay by), Jeff Pinkner (screenplay by), Rick Yancey (based on the novel by)",2016,tt2304933,5.2,"89,598",
212,"Seth Rogen, Zac Efron, Rose Byrne, Chloë Grace Moretz",3 wins & 5 nominations.,N/A,"USA, China",20 Sep 2016,Nicholas Stoller,,Comedy,English,58,"When their new next-door neighbors turn out to be a sorority even more debaucherous than the fraternity previously living there, Mac and Kelly team with their former enemy, Teddy, to bring the girls down.",https://m.media-amazon.com/images/M/MV5BMTY0NzUxMDUzN15BMl5BanBnXkFtZTgwNzI2MTY4ODE@._V1_SX300.jpg,Universal Pictures,R,"[{'Source': 'Internet Movie Database', 'Value': '5.7/10'}, {'Source': 'Rotten Tomatoes', 'Value': '63%'}, {'Source': 'Metacritic', 'Value': '58/100'}]",20 May 2016,True,92 min,Neighbors 2: Sorority Rising,movie,http://www.neighbors-movie.com/,"Andrew Jay Cohen, Brendan O'Brien, Nicholas Stoller, Evan Goldberg, Seth Rogen, Andrew Jay Cohen (based on characters created by), Brendan O'Brien (based on characters created by)",2016,tt4438848,5.7,"100,428",
213,,,,,,,Movie not found!,,,,,,,,,,False,,,,,,,,,,
214,"George Clooney, Julia Roberts, Jack O'Connell, Dominic West",2 nominations.,N/A,USA,06 Sep 2016,Jodie Foster,,"Crime, Drama, Thriller","English, Korean, Icelandic, Russian",55,Financial TV host Lee Gates and his producer Patty are put in an extreme situation when an irate investor takes them and their crew as hostage.,https://m.media-amazon.com/images/M/MV5BMTgzMjU1NDUwMl5BMl5BanBnXkFtZTgwODg1NjY0ODE@._V1_SX300.jpg,Smokehouse Pictures,R,"[{'Source': 'Internet Movie Database', 'Value': '6.5/10'}, {'Source': 'Rotten Tomatoes', 'Value': '58%'}, {'Source': 'Metacritic', 'Value': '55/100'}]",13 May 2016,True,98 min,Money Monster,movie,http://www.sonypictures.com/movies/moneymonster/,"Jamie Linden (screenplay), Alan DiFiore (screenplay), Jim Kouf (screenplay), Alan DiFiore (story), Jim Kouf (story)",2016,tt2241351,6.5,"85,148",
215,"Nia Vardalos, John Corbett, Michael Constantine, Lainie Kazan",3 nominations.,"$52,069,651","USA, Canada",21 Jun 2016,Kirk Jones,,"Comedy, Romance","English, Greek",37,A Portokalos family secret brings the beloved characters back together for an even bigger and Greeker wedding.,https://m.media-amazon.com/images/M/MV5BNTA1MjMzNDM2M15BMl5BanBnXkFtZTgwNTg3NzQ1NzE@._V1_SX300.jpg,Gold Circle Films,PG-13,"[{'Source': 'Internet Movie Database', 'Value': '6.0/10'}, {'Source': 'Rotten Tomatoes', 'Value': '29%'}, {'Source': 'Metacritic', 'Value': '37/100'}]",25 Mar 2016,True,94 min,My Big Fat Greek Wedding 2,movie,http://www.mybigfatgreekweddingmovie.com/,Nia Vardalos,2016,tt3760922,6.0,"25,586",
216,"Will Smith, Edward Norton, Kate Winslet, Michael Peña",1 win & 3 nominations.,"$30,982,955",USA,14 Mar 2017,David Frankel,,"Drama, Romance",English,23,"Retreating from life after a tragedy, a man questions the universe by writing to Love, Time and Death. Receiving unexpected answers, he begins to see how these things interlock and how even loss can reveal moments of meaning and beauty.",https://m.media-amazon.com/images/M/MV5BMTQ5ODE4MTY2NV5BMl5BanBnXkFtZTgwMzM2NzEzMDI@._V1_SX300.jpg,New Line Cinema,PG-13,"[{'Source': 'Internet Movie Database', 'Value': '6.8/10'}, {'Source': 'Rotten Tomatoes', 'Value': '14%'}, {'Source': 'Metacritic', 'Value': '23/100'}]",16 Dec 2016,True,97 min,Collateral Beauty,movie,N/A,Allan Loeb,2016,tt4682786,6.8,"76,471",
217,"Miles Teller, Steve Lantz, Gregg Weiner, David Packouz",Nominated for 1 Golden Globe. Another 2 nominations.,"$43,017,433","USA, Cambodia",22 Nov 2016,Todd Phillips,,"Comedy, Crime, Drama, War","English, Arabic, Albanian, Romanian",57,"Loosely based on the true story of two young men, David Packouz and Efraim Diveroli, who won a three hundred million dollar contract from the Pentagon to arm America's allies in Afghanistan.",https://m.media-amazon.com/images/M/MV5BMjEyNzQ0NzM4MV5BMl5BanBnXkFtZTgwMDI0ODM2OTE@._V1_SX300.jpg,Warner Bros. Pictures,R,"[{'Source': 'Internet Movie Database', 'Value': '7.1/10'}, {'Source': 'Rotten Tomatoes', 'Value': '60%'}, {'Source': 'Metacritic', 'Value': '57/100'}]",19 Aug 2016,True,114 min,War Dogs,movie,http://www.wardogsthemovie.com/,"Stephen Chin (screenplay), Todd Phillips (screenplay), Jason Smilovic (screenplay), Guy Lawson (Rolling Stone article ""Arms and the Dudes"")",2016,tt2005151,7.1,"150,655",
218,"Emma Roberts, Dave Franco, Emily Meade, Miles Heizer",5 nominations.,"$38,562,379",USA,25 Oct 2016,"Henry Joost, Ariel Schulman",,"Action, Adventure, Crime, Drama, Mystery, Thriller",English,58,"A high school senior finds herself immersed in an online game of truth or dare, where her every move starts to become manipulated by an anonymous community of ""watchers.""",https://m.media-amazon.com/images/M/MV5BMTUzOTg1OTM4NV5BMl5BanBnXkFtZTgwMTg2Mjg0OTE@._V1_SX300.jpg,Keep Your Head,PG-13,"[{'Source': 'Internet Movie Database', 'Value': '6.6/10'}, {'Source': 'Rotten Tomatoes', 'Value': '67%'}, {'Source': 'Metacritic', 'Value': '58/100'}]",27 Jul 2016,True,96 min,Nerve,movie,http://www.playnerve.com/,"Jessica Sharzer (screenplay by), Jeanne Ryan (based on the novel by)",2016,tt3531824,6.6,"100,639",
