,Actors,Awards,BoxOffice,Country,DVD,Director,Error,Genre,Language,Metascore,Plot,Poster,Production,Rated,Ratings,Released,Response,Runtime,Title,Type,Website,Writer,Year,imdbID,imdbRating,imdbVotes,totalSeasons
630,"Leonardo DiCaprio, Josh Hamilton, Geoff Pierson, Cheryl Lawson",Nominated for 1 Golden Globe. Another 5 wins & 16 nominations.,"$37,304,451",USA,21 Feb 2012,Clint Eastwood,,"Biography, Crime, Drama, History, Romance",English,59,"J. Edgar Hoover, powerful head of the F.B.I. for nearly 50 years, looks back on his professional and personal life.",https://m.media-amazon.com/images/M/MV5BMTc0NDM4ODU2Nl5BMl5BanBnXkFtZTcwNzQ0NTg4Ng@@._V1_SX300.jpg,Warner Bros. Pictures,R,"[{'Source': 'Internet Movie Database', 'Value': '6.6/10'}, {'Source': 'Rotten Tomatoes', 'Value': '42%'}, {'Source': 'Metacritic', 'Value': '59/100'}]",11 Nov 2011,True,137 min,J. Edgar,movie,http://jedgarmovie.warnerbros.com/,Dustin Lance Black,2011,tt1616195,6.6,"114,991",
631,"Owen Wilson, Jason Sudeikis, Jenna Fischer, Christina Applegate",N/A,"$45,045,037",USA,14 Jun 2011,"Bobby Farrelly, Peter Farrelly",,"Comedy, Romance",English,45,"Rick and Fred, two husbands who are having difficulty in their marriages, are given a Hall Pass by their wives: for one week, they can do whatever they want.",https://m.media-amazon.com/images/M/MV5BMTc4MzIxNTYwNl5BMl5BanBnXkFtZTcwNzE4MjE0NA@@._V1_SX300.jpg,Warner Bros. Pictures,R,"[{'Source': 'Internet Movie Database', 'Value': '5.9/10'}, {'Source': 'Rotten Tomatoes', 'Value': '33%'}, {'Source': 'Metacritic', 'Value': '45/100'}]",25 Feb 2011,True,105 min,Hall Pass,movie,http://www.hall-pass-movie.com,"Pete Jones (screenplay), Peter Farrelly (screenplay), Kevin Barnett (screenplay), Bobby Farrelly (screenplay), Pete Jones (story)",2011,tt0480687,5.9,"112,930",
632,"Martin Lawrence, Brandon T. Jackson, Jessica Lucas, Michelle Ang",4 nominations.,"$37,911,876",USA,14 Jun 2011,John Whitesell,,"Action, Comedy, Crime",English,22,Malcolm Turner and his stepson Trent go undercover at an all-girls school to flush out a killer.,https://m.media-amazon.com/images/M/MV5BMzU2MTk5NzkzNV5BMl5BanBnXkFtZTcwMjU5MzgwNA@@._V1_SX300.jpg,20th Century Fox,PG-13,"[{'Source': 'Internet Movie Database', 'Value': '4.4/10'}, {'Source': 'Rotten Tomatoes', 'Value': '5%'}, {'Source': 'Metacritic', 'Value': '22/100'}]",18 Feb 2011,True,107 min,"Big Mommas: Like Father, Like Son",movie,http://www.bigmommaslikefatherlikeson.com/,"Matthew Fogel (screenplay), Don Rhymer (story), Matthew Fogel (story), Darryl Quarles (characters)",2011,tt1464174,4.4,"23,169",
633,"Jake Andolina, Oriah Acima Andrews, Ken Arnold, Maria Bello",2 wins & 3 nominations.,"$27,600,000",USA,17 Jan 2012,John Singleton,,"Action, Mystery, Thriller",English,25,A thriller centered on a young man who sets out to uncover the truth about his life after finding his baby photo on a missing persons website.,https://m.media-amazon.com/images/M/MV5BMTkxNzU3OTg0Nl5BMl5BanBnXkFtZTcwNDY5MDY2Ng@@._V1_SX300.jpg,Lionsgate Films,PG-13,"[{'Source': 'Internet Movie Database', 'Value': '5.1/10'}, {'Source': 'Rotten Tomatoes', 'Value': '5%'}, {'Source': 'Metacritic', 'Value': '25/100'}]",23 Sep 2011,True,106 min,Abduction,movie,http://www.abductionthefilm.com/,Shawn Christensen,2011,tt1600195,5.1,"71,788",
634,"Paul Bettany, Karl Urban, Cam Gigandet, Maggie Q",3 nominations.,"$29,100,000",USA,16 Aug 2011,Scott Stewart,,"Action, Adventure, Fantasy, Horror, Sci-Fi, Thriller",English,41,A priest disobeys church law to track down the vampires who kidnapped his niece.,https://m.media-amazon.com/images/M/MV5BMTQ1MTAwODc3OV5BMl5BanBnXkFtZTcwNzI0MDQ3NA@@._V1_SX300.jpg,Screen Gems/SONY PICTURES,PG-13,"[{'Source': 'Internet Movie Database', 'Value': '5.7/10'}, {'Source': 'Rotten Tomatoes', 'Value': '15%'}, {'Source': 'Metacritic', 'Value': '41/100'}]",13 May 2011,True,87 min,Priest,movie,http://priest-movie.net/,"Cory Goodman, Min-Woo Hyung (graphic novel series ""Priest"")",2011,tt0822847,5.7,"107,499",
635,"Jason Statham, Ben Foster, Tony Goldwyn, Donald Sutherland",1 nomination.,"$29,113,588",USA,17 May 2011,Simon West,,"Action, Crime, Thriller",English,49,Follows an elite hit man as he teaches his trade to an apprentice who has a connection to one of his previous victims.,https://m.media-amazon.com/images/M/MV5BMjEyMjk1NjI1M15BMl5BanBnXkFtZTcwODcyNjAxNA@@._V1_SX300.jpg,CBS Films,R,"[{'Source': 'Internet Movie Database', 'Value': '6.6/10'}, {'Source': 'Rotten Tomatoes', 'Value': '53%'}, {'Source': 'Metacritic', 'Value': '49/100'}]",28 Jan 2011,True,93 min,The Mechanic,movie,http://www.themechanicmovie.com/,"Richard Wenk (screenplay), Lewis John Carlino (screenplay), Lewis John Carlino (story)",2011,tt0472399,6.6,"139,942",
636,"Ryan Gosling, George Clooney, Philip Seymour Hoffman, Paul Giamatti",Nominated for 1 Oscar. Another 9 wins & 33 nominations.,"$40,962,534",USA,17 Jan 2012,George Clooney,,"Drama, Thriller",English,67,An idealistic staffer for a new presidential candidate gets a crash course on dirty politics during his stint on the campaign trail.,https://m.media-amazon.com/images/M/MV5BNTU4MjkzNTY0OF5BMl5BanBnXkFtZTcwNDI5ODIxNg@@._V1_SX300.jpg,Sony Pictures,R,"[{'Source': 'Internet Movie Database', 'Value': '7.1/10'}, {'Source': 'Rotten Tomatoes', 'Value': '84%'}, {'Source': 'Metacritic', 'Value': '67/100'}]",07 Oct 2011,True,101 min,The Ides of March,movie,http://www.idesofmarch-movie.com/,"George Clooney (screenplay), Grant Heslov (screenplay), Beau Willimon (screenplay), Beau Willimon (play)",2011,tt1124035,7.1,"206,106",
637,"Ryan Reynolds, Jason Bateman, Leslie Mann, Olivia Wilde",1 nomination.,"$37,000,000",USA,08 Nov 2011,David Dobkin,,"Comedy, Fantasy","English, Ukrainian",39,"Dave is a married man with three kids and a loving wife, and Mitch is a single man who is at the prime of his sexual life. One fateful night while Mitch and Dave are peeing in a fountain, lightning strikes and they switch bodies.",https://m.media-amazon.com/images/M/MV5BMTk3NTM4NDg3OF5BMl5BanBnXkFtZTcwNDk3MzEwNQ@@._V1_SX300.jpg,Universal Pictures,R,"[{'Source': 'Internet Movie Database', 'Value': '6.3/10'}, {'Source': 'Rotten Tomatoes', 'Value': '25%'}, {'Source': 'Metacritic', 'Value': '39/100'}]",05 Aug 2011,True,112 min,The Change-Up,movie,http://www.thechangeupmovie.com,"Jon Lucas, Scott Moore",2011,tt1488555,6.3,"153,589",
638,"Matthew McConaughey, Marisa Tomei, Ryan Phillippe, William H. Macy",1 nomination.,"$57,900,000",USA,12 Jul 2011,Brad Furman,,"Crime, Drama, Thriller",English,63,A lawyer defending a wealthy man begins to believe his client is guilty of more than just one crime.,https://m.media-amazon.com/images/M/MV5BMTQ4NDE4NTY5MV5BMl5BanBnXkFtZTcwODQyMTkxNA@@._V1_SX300.jpg,Lionsgate Films,R,"[{'Source': 'Internet Movie Database', 'Value': '7.3/10'}, {'Source': 'Rotten Tomatoes', 'Value': '84%'}, {'Source': 'Metacritic', 'Value': '63/100'}]",18 Mar 2011,True,118 min,The Lincoln Lawyer,movie,http://www.thelincolnlawyermovie.com/,"John Romano (screenplay), Michael Connelly (novel)",2011,tt1189340,7.3,"194,461",
639,"Zachary Gordon, Devon Bostick, Rachael Harris, Robert Capron",2 wins & 5 nominations.,"$52,691,009",USA,21 Jun 2011,David Bowers,,"Comedy, Family",English,51,"Back in middle school after summer vacation, Greg Heffley and his older brother Rodrick must deal with their parents' misguided attempts to have them bond.",https://m.media-amazon.com/images/M/MV5BMTcxNDYwOTEzMl5BMl5BanBnXkFtZTcwOTA3MzY3NA@@._V1_SX300.jpg,20th Century Fox,PG,"[{'Source': 'Internet Movie Database', 'Value': '6.6/10'}, {'Source': 'Rotten Tomatoes', 'Value': '47%'}, {'Source': 'Metacritic', 'Value': '51/100'}]",25 Mar 2011,True,99 min,Diary of a Wimpy Kid: Rodrick Rules,movie,http://www.diaryofawimpykidmovie.com,"Gabe Sachs (screenplay), Jeff Judah (screenplay), Jeff Kinney (book)",2011,tt1650043,6.6,"22,754",
640,"Tom Hanks, Sarah Mahoney, Roxana Ortega, Randall Park",3 nominations.,"$35,565,975",USA,15 Nov 2011,Tom Hanks,,"Comedy, Drama, Romance",English,41,"After losing his job, a middle-aged man reinvents himself by going back to college.",https://m.media-amazon.com/images/M/MV5BYjQ4MzlmZDUtN2ViMi00ZTAwLWFkMmItNGRlZmM1NjQ1ZmJjXkEyXkFqcGdeQXVyMzI0NDc4ODY@._V1_SX300.jpg,Universal Pictures,PG-13,"[{'Source': 'Internet Movie Database', 'Value': '6.1/10'}, {'Source': 'Rotten Tomatoes', 'Value': '37%'}, {'Source': 'Metacritic', 'Value': '41/100'}]",01 Jul 2011,True,98 min,Larry Crowne,movie,http://www.larrycrowne.com/,"Tom Hanks, Nia Vardalos",2011,tt1583420,6.1,"58,068",
641,"Vince Vaughn, Kevin James, Jennifer Connelly, Winona Ryder",1 nomination.,"$48,430,355",USA,03 May 2011,Ron Howard,,"Comedy, Drama",English,46,A man discovers that his best friend's wife is having an affair.,https://m.media-amazon.com/images/M/MV5BMzg3MDUwMTI1OV5BMl5BanBnXkFtZTcwNzY0NDIxNA@@._V1_SX300.jpg,Universal Pictures,PG-13,"[{'Source': 'Internet Movie Database', 'Value': '5.3/10'}, {'Source': 'Metacritic', 'Value': '46/100'}]",14 Jan 2011,True,111 min,The Dilemma,movie,http://www.thedilemmamovie.com/,Allan Loeb,2011,tt1578275,5.3,"47,807",
642,"Saoirse Ronan, Eric Bana, Vicky Krieps, Cate Blanchett",8 wins & 25 nominations.,"$40,200,000","USA, UK, Germany",06 Sep 2011,Joe Wright,,"Action, Drama, Thriller","English, French, German, Italian, Arabic, Spanish",65,"A sixteen-year-old girl who was raised by her father to be the perfect assassin is dispatched on a mission across Europe, tracked by a ruthless intelligence agent and her operatives.",https://m.media-amazon.com/images/M/MV5BMjljNzE0OTItM2Q1MS00MTUyLTg4YjgtMzUzZDRkMzkyN2NiXkEyXkFqcGdeQXVyODU2MDg1NzU@._V1_SX300.jpg,Focus Features,PG-13,"[{'Source': 'Internet Movie Database', 'Value': '6.8/10'}, {'Source': 'Rotten Tomatoes', 'Value': '72%'}, {'Source': 'Metacritic', 'Value': '65/100'}]",08 Apr 2011,True,111 min,Hanna,movie,http://www.HannatheMovie.com/,"Seth Lochhead (screenplay), David Farr (screenplay), Seth Lochhead (story)",2011,tt0993842,6.8,"176,555",
643,"Zoe Saldana, Jordi Mollà, Lennie James, Amandla Stenberg",2 wins & 5 nominations.,"$36,665,854",France,20 Dec 2011,Olivier Megaton,,"Action, Drama, Thriller","English, Spanish",45,"A young woman, after witnessing her parents' murder as a child in Bogota, grows up to be a stone-cold assassin.",https://m.media-amazon.com/images/M/MV5BMTM0NDI2NjgxNl5BMl5BanBnXkFtZTcwMTYyNjA3NQ@@._V1_SX300.jpg,Sony Pictures,PG-13,"[{'Source': 'Internet Movie Database', 'Value': '6.4/10'}, {'Source': 'Rotten Tomatoes', 'Value': '29%'}, {'Source': 'Metacritic', 'Value': '45/100'}]",26 Aug 2011,True,108 min,Colombiana,movie,http://colombiana-movie.com,"Luc Besson (screenplay), Robert Mark Kamen (screenplay)",2011,tt1657507,6.4,"86,887",
644,"Ginnifer Goodwin, Kate Hudson, Colin Egglesfield, John Krasinski",5 nominations.,"$39,000,000",USA,16 Aug 2011,Luke Greenfield,,"Comedy, Drama, Romance",English,36,"Friendships are tested and secrets come to the surface when terminally single Rachel falls for Dex, her best friend Darcy's fiancé.",https://m.media-amazon.com/images/M/MV5BNzczNzMzODk0Nl5BMl5BanBnXkFtZTcwMjgwMjI0NA@@._V1_SX300.jpg,Warner Bros.,PG-13,"[{'Source': 'Internet Movie Database', 'Value': '5.9/10'}, {'Source': 'Rotten Tomatoes', 'Value': '15%'}, {'Source': 'Metacritic', 'Value': '36/100'}]",06 May 2011,True,112 min,Something Borrowed,movie,http://somethingborrowedmovie.warnerbros.com/,"Jennie Snyder Urman (screenplay), Emily Giffin (novel)",2011,tt0491152,5.9,"53,858",
645,"Jason Statham, Clive Owen, Robert De Niro, Dominic Purcell",2 wins & 7 nominations.,"$25,093,607","UK, Australia",10 Jan 2012,Gary McKendry,,"Action, Crime, Thriller","English, Arabic, French, Spanish",44,"When his mentor is taken captive by a disgraced Arab sheik, a killer-for-hire is forced into action. His mission: kill three members of Britain's elite Special Air Service responsible for the death of his sons.",https://m.media-amazon.com/images/M/MV5BMTc4MDAxMjAzNV5BMl5BanBnXkFtZTcwNTY3ODg3NQ@@._V1_SX300.jpg,Open Road Films,R,"[{'Source': 'Internet Movie Database', 'Value': '6.5/10'}, {'Source': 'Rotten Tomatoes', 'Value': '26%'}, {'Source': 'Metacritic', 'Value': '44/100'}]",23 Sep 2011,True,116 min,Killer Elite,movie,http://www.KillerElite.com,"Matt Sherring (screenplay), Ranulph Fiennes (book)",2011,tt1448755,6.5,"116,908",
646,"Tom Hanks, Thomas Horn, Sandra Bullock, Zoe Caldwell",Nominated for 2 Oscars. Another 8 wins & 23 nominations.,"$31,836,745",USA,27 Mar 2012,Stephen Daldry,,"Adventure, Drama, Mystery",English,46,"A nine-year-old amateur inventor, Francophile, and pacifist searches New York City for the lock that matches a mysterious key left behind by his father, who died in the World Trade Center on September 11, 2001.",https://m.media-amazon.com/images/M/MV5BMTUxNzYwMTE3NV5BMl5BanBnXkFtZTcwMDY2NzU4Ng@@._V1_SX300.jpg,Warner Bros. Pictures,PG-13,"[{'Source': 'Internet Movie Database', 'Value': '6.9/10'}, {'Source': 'Rotten Tomatoes', 'Value': '46%'}, {'Source': 'Metacritic', 'Value': '46/100'}]",20 Jan 2012,True,129 min,Extremely Loud & Incredibly Close,movie,http://extremelyloudandincrediblyclose.warnerbros.com/,"Eric Roth (screenplay), Jonathan Safran Foer (novel)",2011,tt0477302,6.9,"92,628",
647,"Sebastian Cabot, Junius Matthews, Barbara Luddy, Howard Morris",1 nomination.,N/A,USA,07 May 2002,"John Lounsbery, Wolfgang Reitherman",,"Animation, Comedy, Family, Musical",English,N/A,A collection of animated shorts based on the stories and characters by A. A. Milne.,https://m.media-amazon.com/images/M/MV5BNjg5MjQzYTQtMTUzZC00NzlkLTgzZDEtMjg0OWY4NTNjNzJlXkEyXkFqcGdeQXVyNjI4MjU4MTY@._V1_SX300.jpg,Walt Disney Productions,G,"[{'Source': 'Internet Movie Database', 'Value': '7.6/10'}, {'Source': 'Rotten Tomatoes', 'Value': '100%'}]",11 Mar 1977,True,74 min,The Many Adventures of Winnie the Pooh,movie,N/A,"A.A. Milne (books), Larry Clemmons (story), Ralph Wright (story), Vance Gerry (story), Xavier Atencio (story), Ken Anderson (story), Julius Svendsen (story), Ted Berman (story), Eric Cleworth (story), Winston Hibler (story supervisor ""Blustery Day"")",1977,tt0076363,7.6,"29,319",
648,"AnnaSophia Robb, Helen Hunt, Dennis Quaid, Carrie Underwood",1 win & 12 nominations.,"$43,853,424",USA,02 Aug 2011,Sean McNamara,,"Biography, Drama, Family, Sport",English,53,Teenage surfer Bethany Hamilton overcomes the odds and her own fears of returning to the water after losing her left arm in a shark attack.,https://m.media-amazon.com/images/M/MV5BMTU2MDg0OTYyM15BMl5BanBnXkFtZTcwMjg5MjY0NA@@._V1_SX300.jpg,TriStar/FilmDistrict,PG,"[{'Source': 'Internet Movie Database', 'Value': '7.1/10'}, {'Source': 'Rotten Tomatoes', 'Value': '45%'}, {'Source': 'Metacritic', 'Value': '53/100'}]",08 Apr 2011,True,112 min,Soul Surfer,movie,http://www.soulsurferthemovie.com/,"Sean McNamara (screenplay), Deborah Schwartz (screenplay), Douglas Schwartz (screenplay), Michael Berk (screenplay), Sean McNamara (screen story), Deborah Schwartz (screen story), Douglas Schwartz (screen story), Michael Berk (screen story), Matt Allen (screen story), Caleb Wilson (screen story), Brad Gann (screen story), Bethany Hamilton (book), Sheryl Berk (book), Rick Bundschuh (book)",2011,tt1596346,7.1,"41,093",
649,"Helen Mirren, Tom Wilkinson, Ciarán Hinds, Romi Aboulafia",13 wins & 5 nominations.,"$31,146,570","USA, UK, Hungary, Israel",06 Dec 2011,John Madden,,"Drama, Thriller","English, German, Russian",65,"In 1965, three Mossad agents cross into East Berlin to apprehend a notorious Nazi war criminal. Thirty years later, the secrets the agents share come back to haunt them.",https://m.media-amazon.com/images/M/MV5BMjY0Mzk5MjIwNl5BMl5BanBnXkFtZTcwNzg5MDYyNQ@@._V1_SX300.jpg,Focus Features,R,"[{'Source': 'Internet Movie Database', 'Value': '6.9/10'}, {'Source': 'Rotten Tomatoes', 'Value': '76%'}, {'Source': 'Metacritic', 'Value': '65/100'}]",31 Aug 2011,True,113 min,The Debt,movie,http://www.SeeTheDebt.com,"Matthew Vaughn (screenplay), Jane Goldman (screenplay), Peter Straughan (screenplay), Assaf Bernstein (film ""Ha-Hov""), Ido Rosenblum (film ""Ha-Hov"")",2010,tt1226753,6.9,"60,680",
650,"Alex Pettyfer, Justin Bradley, Mary-Kate Olsen, Dakota Johnson",1 win & 1 nomination.,"$27,854,896",USA,28 Jun 2011,Daniel Barnz,,"Drama, Fantasy, Romance",English,40,"A modern-day take on the ""Beauty and the Beast"" tale where a New York teen is transformed into a hideous monster in order to find true love.",https://m.media-amazon.com/images/M/MV5BMzUzMTcxMTEzNV5BMl5BanBnXkFtZTcwMTcwNjcxNA@@._V1_SX300.jpg,CBS Films,PG-13,"[{'Source': 'Internet Movie Database', 'Value': '5.6/10'}, {'Source': 'Rotten Tomatoes', 'Value': '20%'}, {'Source': 'Metacritic', 'Value': '40/100'}]",04 Mar 2011,True,86 min,Beastly,movie,http://www.beastlythemovie.com/,"Daniel Barnz (screenplay), Alex Flinn (novel)",2011,tt1152398,5.6,"72,089",
651,"Jesse Eisenberg, Danny McBride, Aziz Ansari, Nick Swardson",N/A,"$37,100,000",USA,29 Nov 2011,Ruben Fleischer,,"Action, Comedy, Crime","English, German, Spanish",49,"Two fledgling criminals kidnap a pizza delivery guy, strap a bomb to his chest, and inform him that he has mere hours to rob a bank or else...",https://m.media-amazon.com/images/M/MV5BMTM5NjM0ODY1NF5BMl5BanBnXkFtZTcwMjk5NjI0Ng@@._V1_SX300.jpg,Sony Pictures,R,"[{'Source': 'Internet Movie Database', 'Value': '6.1/10'}, {'Source': 'Rotten Tomatoes', 'Value': '45%'}, {'Source': 'Metacritic', 'Value': '49/100'}]",12 Aug 2011,True,83 min,30 Minutes or Less,movie,http://www.30minutesorless.com/,"Michael Diliberti (screenplay), Michael Diliberti (story), Matthew Sullivan (story)",2011,tt1622547,6.1,"86,332",
652,"Leighton Meester, Minka Kelly, Cam Gigandet, Aly Michalka",7 nominations.,"$37,300,107",USA,17 May 2011,Christian E. Christiansen,,"Drama, Thriller",English,23,"When college freshman Sara arrives on campus for the first time, she befriends her roommate, Rebecca, unaware that the girl is becoming dangerously obsessed with her.",https://m.media-amazon.com/images/M/MV5BMjIwMzQwMzMwNF5BMl5BanBnXkFtZTcwNjE5MTUxNA@@._V1_SX300.jpg,Screen Gems/SONY PICTURES,PG-13,"[{'Source': 'Internet Movie Database', 'Value': '4.9/10'}, {'Source': 'Rotten Tomatoes', 'Value': '4%'}, {'Source': 'Metacritic', 'Value': '23/100'}]",04 Feb 2011,True,91 min,The Roommate,movie,http://www.theroommate-movie.com/,Sonny Mallhi,2011,tt1265990,4.9,"32,747",
653,"Joseph Gordon-Levitt, Seth Rogen, Anna Kendrick, Bryce Dallas Howard",Nominated for 2 Golden Globes. Another 12 wins & 25 nominations.,"$35,005,118",USA,24 Jan 2012,Jonathan Levine,,"Comedy, Drama, Romance",English,72,"Inspired by a true story, a comedy centered on a 27-year-old guy who learns of his cancer diagnosis and his subsequent struggle to beat the disease.",https://m.media-amazon.com/images/M/MV5BNjg3ODQyNTIyN15BMl5BanBnXkFtZTcwMjUzNzM5NQ@@._V1_SX300.jpg,Summit Entertainment,R,"[{'Source': 'Internet Movie Database', 'Value': '7.7/10'}, {'Source': 'Rotten Tomatoes', 'Value': '93%'}, {'Source': 'Metacritic', 'Value': '72/100'}]",30 Sep 2011,True,100 min,50/50,movie,http://50-50themovie.com/,Will Reiser,2011,tt1306980,7.7,"298,597",
654,"Angela Bassett, Paula Patton, Laz Alonso, Loretta Devine",3 wins & 13 nominations.,"$37,295,394",USA,09 Aug 2011,Salim Akil,,"Comedy, Drama",English,56,Two very different families converge on Martha's Vineyard one weekend for a wedding.,https://m.media-amazon.com/images/M/MV5BMTg4NjA3OTQ0OF5BMl5BanBnXkFtZTcwOTQ1NjA2NA@@._V1_SX300.jpg,Sony Pictures,PG-13,"[{'Source': 'Internet Movie Database', 'Value': '5.7/10'}, {'Source': 'Rotten Tomatoes', 'Value': '57%'}, {'Source': 'Metacritic', 'Value': '56/100'}]",06 May 2011,True,112 min,Jumping the Broom,movie,http://jumpingthebroom-movie.com/,"Elizabeth Hunter (screenplay), Arlene Gibbs (screenplay), Elizabeth Hunter (story)",2011,tt1640484,5.7,"8,959",
655,"Bruce Gleeson, Eddie Ritchard, Garry McDonald, Bailee Madison",4 nominations.,"$23,900,000","USA, Australia, Mexico",03 Jan 2012,Troy Nixey,,"Fantasy, Horror, Thriller",English,56,A young girl sent to live with her father and his new girlfriend believes that she has released creatures from a sealed ash pit in the basement of her new home.,https://m.media-amazon.com/images/M/MV5BMTYwMDk4ODU0OV5BMl5BanBnXkFtZTcwMDY2NDE0Ng@@._V1_SX300.jpg,Miramax Films,R,"[{'Source': 'Internet Movie Database', 'Value': '5.6/10'}, {'Source': 'Rotten Tomatoes', 'Value': '59%'}, {'Source': 'Metacritic', 'Value': '56/100'}]",26 Aug 2011,True,99 min,Don't Be Afraid of the Dark,movie,http://www.dontbeafraidofthedark.com,"Guillermo del Toro (screenplay), Matthew Robbins (screenplay), Nigel McKeand",2010,tt1270761,5.6,"44,260",
656,"Patton Oswalt, Isabella Gielniak, Kal Penn, Austin Bickel",1 nomination.,"$34,400,000",USA,07 Feb 2012,Todd Strauss-Schulson,,"Adventure, Comedy",English,61,"Six years after their Guantanamo Bay adventure, stoner buds Harold Lee and Kumar Patel cause a holiday fracas by inadvertently burning down Harold's father-in-law's prize Christmas tree.",https://m.media-amazon.com/images/M/MV5BMzA1NTQzMjAyOV5BMl5BanBnXkFtZTcwNDcyMjY2Ng@@._V1_SX300.jpg,Warner Bros. Pictures,R,"[{'Source': 'Internet Movie Database', 'Value': '6.3/10'}, {'Source': 'Rotten Tomatoes', 'Value': '68%'}, {'Source': 'Metacritic', 'Value': '61/100'}]",04 Nov 2011,True,90 min,A Very Harold & Kumar 3D Christmas,movie,http://www.haroldandkumar.com,"Jon Hurwitz, Hayden Schlossberg, Jon Hurwitz (characters), Hayden Schlossberg (characters)",2011,tt1268799,6.3,"61,754",
657,"Jonah Hill, Max Records, Ari Graynor, J.B. Smoove",2 nominations.,"$30,200,000",USA,20 Mar 2012,David Gordon Green,,Comedy,English,39,"A college student on suspension is coaxed into babysitting the kids next door, though he is fully unprepared for the wild night ahead of him.",https://m.media-amazon.com/images/M/MV5BZDU1ZWJmMmUtM2Q5Ny00MjdhLWE0OTMtMWJkMjg1OTc2YTgxXkEyXkFqcGdeQXVyNDk3NzU2MTQ@._V1_SX300.jpg,20th Century Fox,R,"[{'Source': 'Internet Movie Database', 'Value': '5.7/10'}, {'Source': 'Rotten Tomatoes', 'Value': '22%'}, {'Source': 'Metacritic', 'Value': '39/100'}]",09 Dec 2011,True,81 min,The Sitter,movie,http://www.thesittermovie.com/,"Brian Gatewood, Alessandro Tanaka",2011,tt1366344,5.7,"65,291",
658,"Ken Bevel, Alex Kendrick, Kevin Downes, Renee Jewell",2 wins & 2 nominations.,"$34,522,221",USA,16 Jan 2012,Alex Kendrick,,Drama,English,42,"When a tragedy strikes close to home, four police officers struggle with their faith and their roles as husbands and fathers; together they make a decision that will change all of their lives.",https://m.media-amazon.com/images/M/MV5BMjEyODMxNjM4OF5BMl5BanBnXkFtZTcwMTg5OTg3NQ@@._V1_SX300.jpg,Sony Pictures,PG-13,"[{'Source': 'Internet Movie Database', 'Value': '7.1/10'}, {'Source': 'Rotten Tomatoes', 'Value': '33%'}, {'Source': 'Metacritic', 'Value': '42/100'}]",30 Sep 2011,True,129 min,Courageous,movie,http://www.courageousthemovie.com/,"Alex Kendrick, Stephen Kendrick",2011,tt1630036,7.1,"17,382",
659,"Paul Rudd, Nick Sullivan, Francesca Papalia, Bob Stephenson",N/A,"$24,600,000",USA,29 Nov 2011,Jesse Peretz,,"Comedy, Drama",English,60,A comedy centered on an idealist who barges into the lives of his three sisters.,https://m.media-amazon.com/images/M/MV5BMTU3NjM3Mzg0Ml5BMl5BanBnXkFtZTcwOTk4MDI3NQ@@._V1_SX300.jpg,The Weinstein Company,R,"[{'Source': 'Internet Movie Database', 'Value': '6.4/10'}, {'Source': 'Rotten Tomatoes', 'Value': '69%'}, {'Source': 'Metacritic', 'Value': '60/100'}]",26 Aug 2011,True,90 min,Our Idiot Brother,movie,http://www.ouridiotbrother.com/,"Jesse Peretz (story), Evgenia Peretz (story), David Schisgall (story), Evgenia Peretz (screenplay), David Schisgall (screenplay)",2011,tt1637706,6.4,"80,191",
660,"Cameron Diaz, Leslie Mann, Nikolaj Coster-Waldau, Don Johnson",3 wins & 5 nominations.,"$77,860,761",USA,29 Jul 2014,Nick Cassavetes,,"Comedy, Romance",English,39,"After discovering her boyfriend is married, Carly soon meets the wife he's been betraying. And when yet another love affair is discovered, all three women team up to plot revenge on the three-timing S.O.B.",https://m.media-amazon.com/images/M/MV5BMTc0ODE4ODY1OF5BMl5BanBnXkFtZTgwMDA5NjkzMTE@._V1_SX300.jpg,20th Century Fox,PG-13,"[{'Source': 'Internet Movie Database', 'Value': '6.0/10'}, {'Source': 'Rotten Tomatoes', 'Value': '25%'}, {'Source': 'Metacritic', 'Value': '39/100'}]",25 Apr 2014,True,109 min,The Other Woman,movie,http://otherwomanmovie.com,Melissa Stack,2014,tt2203939,6.0,"121,786",
661,"Tom Hanks, Tim Allen, Joan Cusack, Ned Beatty",Won 2 Oscars. Another 58 wins & 91 nominations.,"$414,984,497",USA,02 Nov 2010,Lee Unkrich,,"Animation, Adventure, Comedy, Family, Fantasy","English, Spanish",92,"The toys are mistakenly delivered to a day-care center instead of the attic right before Andy leaves for college, and it's up to Woody to convince the other toys that they weren't abandoned and to return home.",https://m.media-amazon.com/images/M/MV5BMTgxOTY4Mjc0MF5BMl5BanBnXkFtZTcwNTA4MDQyMw@@._V1_SX300.jpg,Walt Disney Pictures,G,"[{'Source': 'Internet Movie Database', 'Value': '8.3/10'}, {'Source': 'Rotten Tomatoes', 'Value': '98%'}, {'Source': 'Metacritic', 'Value': '92/100'}]",18 Jun 2010,True,103 min,Toy Story 3,movie,http://www.disney.com/ToyStory,"John Lasseter (story by), Andrew Stanton (story by), Lee Unkrich (story by), Michael Arndt (screenplay by)",2010,tt0435761,8.3,"670,263",
