,Actors,Awards,BoxOffice,Country,DVD,Director,Error,Genre,Language,Metascore,Plot,Poster,Production,Rated,Ratings,Released,Response,Runtime,Title,Type,Website,Writer,Year,imdbID,imdbRating,imdbVotes,totalSeasons
413,"Chris Pine, Zachary Quinto, Zoe Saldana, Karl Urban",Nominated for 1 Oscar. Another 6 wins & 56 nominations.,"$228,756,232",USA,10 Sep 2013,J.J. Abrams,,"Action, Adventure, Sci-Fi","English, Klingon",72,"After the crew of the Enterprise find an unstoppable force of terror from within their own organization, Captain Kirk leads a manhunt to a war-zone world to capture a one-man weapon of mass destruction.",https://m.media-amazon.com/images/M/MV5BMTk2NzczOTgxNF5BMl5BanBnXkFtZTcwODQ5ODczOQ@@._V1_SX300.jpg,Paramount,PG-13,"[{'Source': 'Internet Movie Database', 'Value': '7.7/10'}, {'Source': 'Rotten Tomatoes', 'Value': '85%'}, {'Source': 'Metacritic', 'Value': '72/100'}]",16 May 2013,True,132 min,Star Trek Into Darkness,movie,http://www.startrekmovie.com/,"Roberto Orci, Alex Kurtzman, Damon Lindelof, Gene Roddenberry (television series ""Star Trek"")",2013,tt1408101,7.7,"442,890",
414,"Hugh Jackman, Tao Okamoto, Rila Fukushima, Hiroyuki Sanada",2 wins & 11 nominations.,"$132,550,960","USA, UK",03 Dec 2013,James Mangold,,"Action, Adventure, Sci-Fi","English, Japanese",61,"Wolverine comes to Japan to meet an old friend whose life he saved years ago, and gets embroiled in a conspiracy involving yakuza and mutants.",https://m.media-amazon.com/images/M/MV5BNzg1MDQxMTQ2OF5BMl5BanBnXkFtZTcwMTk3MjAzOQ@@._V1_SX300.jpg,20th Century Fox,PG-13,"[{'Source': 'Internet Movie Database', 'Value': '6.7/10'}, {'Source': 'Rotten Tomatoes', 'Value': '71%'}, {'Source': 'Metacritic', 'Value': '61/100'}]",26 Jul 2013,True,126 min,The Wolverine,movie,http://www.thewolverinemovie.com/us/,"Mark Bomback (screenplay), Scott Frank (screenplay)",2013,tt1430132,6.7,"395,575",
415,"Charlie Hunnam, Diego Klattenhoff, Idris Elba, Rinko Kikuchi",Nominated for 1 BAFTA Film Award. Another 6 wins & 47 nominations.,"$101,785,482",USA,15 Oct 2013,Guillermo del Toro,,"Action, Adventure, Sci-Fi","English, Japanese, Cantonese, Mandarin",65,"As a war between humankind and monstrous sea creatures wages on, a former pilot and a trainee are paired up to drive a seemingly obsolete special weapon in a desperate effort to save the world from the apocalypse.",https://m.media-amazon.com/images/M/MV5BMTY3MTI5NjQ4Nl5BMl5BanBnXkFtZTcwOTU1OTU0OQ@@._V1_SX300.jpg,Warner Bros. Pictures,PG-13,"[{'Source': 'Internet Movie Database', 'Value': '6.9/10'}, {'Source': 'Rotten Tomatoes', 'Value': '72%'}, {'Source': 'Metacritic', 'Value': '65/100'}]",12 Jul 2013,True,131 min,Pacific Rim,movie,http://pacificrimmovie.com,"Travis Beacham (screenplay), Guillermo del Toro (screenplay), Travis Beacham (story)",2013,tt1663662,6.9,"439,030",
416,"Leonardo DiCaprio, Jonah Hill, Margot Robbie, Matthew McConaughey",Nominated for 5 Oscars. Another 38 wins & 165 nominations.,"$91,330,760",USA,25 Mar 2014,Martin Scorsese,,"Biography, Crime, Drama","English, French",75,"Based on the true story of Jordan Belfort, from his rise to a wealthy stock-broker living the high life to his fall involving crime, corruption and the federal government.",https://m.media-amazon.com/images/M/MV5BMjIxMjgxNTk0MF5BMl5BanBnXkFtZTgwNjIyOTg2MDE@._V1_SX300.jpg,Paramount Studios,R,"[{'Source': 'Internet Movie Database', 'Value': '8.2/10'}, {'Source': 'Rotten Tomatoes', 'Value': '78%'}, {'Source': 'Metacritic', 'Value': '75/100'}]",25 Dec 2013,True,180 min,The Wolf of Wall Street,movie,http://www.thewolfofwallstreet.com/,"Terence Winter (screenplay), Jordan Belfort (book)",2013,tt0993846,8.2,"1,014,688",
417,"Dwayne Johnson, Jonathan Pryce, Byung-Hun Lee, Elodie Yung",1 win & 11 nominations.,"$122,512,052",USA,30 Jul 2013,Jon M. Chu,,"Action, Adventure, Sci-Fi, Thriller",English,41,The G.I. Joes are not only fighting their mortal enemy Cobra; they are forced to contend with threats from within the government that jeopardize their very existence.,https://m.media-amazon.com/images/M/MV5BNzk5ODM0OTQ0N15BMl5BanBnXkFtZTcwODg2ODE4OA@@._V1_SX300.jpg,Paramount Pictures,PG-13,"[{'Source': 'Internet Movie Database', 'Value': '5.8/10'}, {'Source': 'Rotten Tomatoes', 'Value': '29%'}, {'Source': 'Metacritic', 'Value': '41/100'}]",28 Mar 2013,True,110 min,G.I. Joe: Retaliation,movie,http://www.gijoemovie.com/,"Rhett Reese, Paul Wernick",2013,tt1583421,5.8,"164,520",
418,"Bradley Cooper, Ed Helms, Zach Galifianakis, Justin Bartha",2 wins & 7 nominations.,"$112,200,000",USA,08 Oct 2013,Todd Phillips,,"Adventure, Comedy, Crime","English, Spanish",30,"When one of their own is kidnapped by an angry gangster, the Wolf Pack must track down Mr. Chow, who has escaped from prison and is on the run.",https://m.media-amazon.com/images/M/MV5BMTA0NjE1MzMzODheQTJeQWpwZ15BbWU3MDY4MTQ3Mzk@._V1_SX300.jpg,Warner Bros. Pictures,R,"[{'Source': 'Internet Movie Database', 'Value': '5.8/10'}, {'Source': 'Rotten Tomatoes', 'Value': '20%'}, {'Source': 'Metacritic', 'Value': '30/100'}]",23 May 2013,True,100 min,The Hangover Part III,movie,http://www.hangoverpart3.com/,"Todd Phillips, Craig Mazin, Jon Lucas (characters), Scott Moore (characters)",2013,tt1951261,5.8,"267,229",
419,"Jesse Eisenberg, Mark Ruffalo, Woody Harrelson, Isla Fisher",1 win & 3 nominations.,"$117,698,894","USA, France",03 Sep 2013,Louis Leterrier,,"Crime, Mystery, Thriller","English, French",50,"An F.B.I. Agent and an Interpol Detective track a team of illusionists who pull off bank heists during their performances, and reward their audiences with the money.",https://m.media-amazon.com/images/M/MV5BMTY0NDY3MDMxN15BMl5BanBnXkFtZTcwOTM5NzMzOQ@@._V1_SX300.jpg,Lionsgate Films,PG-13,"[{'Source': 'Internet Movie Database', 'Value': '7.3/10'}, {'Source': 'Rotten Tomatoes', 'Value': '50%'}, {'Source': 'Metacritic', 'Value': '50/100'}]",31 May 2013,True,115 min,Now You See Me,movie,http://nowyouseememovie.com/,"Ed Solomon (screenplay), Boaz Yakin (screenplay), Edward Ricourt (screenplay), Boaz Yakin (story), Edward Ricourt (story)",2013,tt1670345,7.3,"546,921",
420,"Hank Azaria, Neil Patrick Harris, Brendan Gleeson, Jayma Mays",8 nominations.,"$71,017,784","USA, France, Canada, Belgium",03 Dec 2013,Raja Gosnell,,"Animation, Adventure, Comedy, Family, Fantasy","English, French",34,"The Smurfs team up with their human friends to rescue Smurfette, who has been abducted by Gargamel, since she knows a secret spell that can turn the evil sorcerer's newest creation, creatures called ""The Naughties"", into real Smurfs.",https://m.media-amazon.com/images/M/MV5BNzVkMDRlYzItOTUyOS00ZmU5LWEyN2EtMWE2YWU4MzBlOTBjXkEyXkFqcGdeQXVyNDQ2MTMzODA@._V1_SX300.jpg,Sony Pictures,PG,"[{'Source': 'Internet Movie Database', 'Value': '5.4/10'}, {'Source': 'Rotten Tomatoes', 'Value': '14%'}, {'Source': 'Metacritic', 'Value': '34/100'}]",31 Jul 2013,True,105 min,The Smurfs 2,movie,http://www.smurfhappens.com/,"J. David Stem (screenplay), David N. Weiss (screenplay), Jay Scherick (screenplay), David Ronn (screenplay), Karey Kirkpatrick (screenplay), J. David Stem (story), David N. Weiss (story), Jay Scherick (story), David Ronn (story), Peyo (characters and works)",2013,tt2017020,5.4,"33,707",
421,"Vera Farmiga, Patrick Wilson, Lili Taylor, Ron Livingston",15 wins & 22 nominations.,"$137,387,272",USA,22 Oct 2013,James Wan,,"Horror, Mystery, Thriller","English, Latin",68,Paranormal investigators Ed and Lorraine Warren work to help a family terrorized by a dark presence in their farmhouse.,https://m.media-amazon.com/images/M/MV5BMTM3NjA1NDMyMV5BMl5BanBnXkFtZTcwMDQzNDMzOQ@@._V1_SX300.jpg,Warner Bros. Pictures,R,"[{'Source': 'Internet Movie Database', 'Value': '7.5/10'}, {'Source': 'Rotten Tomatoes', 'Value': '85%'}, {'Source': 'Metacritic', 'Value': '68/100'}]",19 Jul 2013,True,112 min,The Conjuring,movie,http://www.theconjuring-movie.com,"Chad Hayes, Carey W. Hayes",2013,tt1457767,7.5,"388,854",
422,"Bruce Willis, Jai Courtney, Sebastian Koch, Mary Elizabeth Winstead",4 wins & 7 nominations.,"$67,344,392",USA,04 Jun 2013,John Moore,,"Action, Thriller","English, Russian, Hindi, Punjabi",28,"John McClane travels to Russia to help out his seemingly wayward son, Jack, only to discover that Jack is a CIA operative working undercover, causing the father and son to team up against underworld forces.",https://m.media-amazon.com/images/M/MV5BMTcwNzgyNzUzOV5BMl5BanBnXkFtZTcwMzAwOTA5OA@@._V1_SX300.jpg,20th Century Fox,R,"[{'Source': 'Internet Movie Database', 'Value': '5.3/10'}, {'Source': 'Rotten Tomatoes', 'Value': '15%'}, {'Source': 'Metacritic', 'Value': '28/100'}]",14 Feb 2013,True,98 min,A Good Day to Die Hard,movie,http://www.diehardmovie.com/,"Skip Woods, Roderick Thorp (certain original characters by)",2013,tt1606378,5.3,"186,747",
423,"Tom Cruise, Morgan Freeman, Olga Kurylenko, Andrea Riseborough",14 nominations.,"$89,021,735",USA,06 Aug 2013,Joseph Kosinski,,"Action, Adventure, Sci-Fi",English,54,A veteran assigned to extract Earth's remaining resources begins to question what he knows about his mission and himself.,https://m.media-amazon.com/images/M/MV5BMTQwMDY0MTA4MF5BMl5BanBnXkFtZTcwNzI3MDgxOQ@@._V1_SX300.jpg,Universal Pictures,PG-13,"[{'Source': 'Internet Movie Database', 'Value': '7.0/10'}, {'Source': 'Rotten Tomatoes', 'Value': '53%'}, {'Source': 'Metacritic', 'Value': '54/100'}]",19 Apr 2013,True,124 min,Oblivion,movie,http://www.oblivionmovie.com/,"Karl Gajdusek (screenplay), Michael Arndt (screenplay), Joseph Kosinski (graphic novel original story)",2013,tt1483013,7.0,"448,126",
424,"Matt Damon, Jodie Foster, Sharlto Copley, Alice Braga",1 win & 10 nominations.,"$90,800,000",USA,17 Dec 2013,Neill Blomkamp,,"Action, Drama, Sci-Fi","English, Spanish, French, Afrikaans, Ukrainian",61,"In the year 2154, the very wealthy live on a man-made space station while the rest of the population resides on a ruined Earth. A man takes on a mission that could bring equality to the polarized worlds.",https://m.media-amazon.com/images/M/MV5BNDc2NjU0MTcwNV5BMl5BanBnXkFtZTcwMjg4MDg2OQ@@._V1_SX300.jpg,TriStar Pictures,R,"[{'Source': 'Internet Movie Database', 'Value': '6.6/10'}, {'Source': 'Rotten Tomatoes', 'Value': '66%'}, {'Source': 'Metacritic', 'Value': '61/100'}]",09 Aug 2013,True,109 min,Elysium,movie,http://www.itsbetterupthere.com/site/,Neill Blomkamp,2013,tt1535108,6.6,"390,652",
425,"Ryan Reynolds, Paul Giamatti, Michael Peña, Samuel L. Jackson",1 win & 13 nominations.,"$81,100,000",USA,12 Nov 2013,David Soren,,"Animation, Adventure, Comedy, Family, Sci-Fi, Sport",English,58,A freak accident might just help an everyday garden snail achieve his biggest dream: winning the Indy 500.,https://m.media-amazon.com/images/M/MV5BMTA4NTgwMjM5MzheQTJeQWpwZ15BbWU3MDg2ODA1ODk@._V1_SX300.jpg,DreamWorks Animation,PG,"[{'Source': 'Internet Movie Database', 'Value': '6.4/10'}, {'Source': 'Rotten Tomatoes', 'Value': '67%'}, {'Source': 'Metacritic', 'Value': '58/100'}]",17 Jul 2013,True,96 min,Turbo,movie,http://www.turbomovie.com,"Darren Lemke (screenplay by), Robert Siegel (screenplay by), David Soren (screenplay by), David Soren (story by)",2013,tt1860353,6.4,"73,444",
426,"Bill Hader, Anna Faris, James Caan, Will Forte",16 nominations.,"$119,793,567",USA,28 Jan 2014,"Cody Cameron, Kris Pearn",,"Animation, Action, Adventure, Comedy, Family, Fantasy, Sci-Fi",English,59,"Flint Lockwood now works at The Live Corp Company for his idol Chester V. But he's forced to leave his post when he learns that his most infamous machine is still operational, and is churning out menacing food-animal hybrids.",https://m.media-amazon.com/images/M/MV5BMTYzNDM0MDI1NF5BMl5BanBnXkFtZTcwNzQ5NzYxOQ@@._V1_SX300.jpg,Sony Pictures,PG,"[{'Source': 'Internet Movie Database', 'Value': '6.4/10'}, {'Source': 'Rotten Tomatoes', 'Value': '71%'}, {'Source': 'Metacritic', 'Value': '59/100'}]",27 Sep 2013,True,95 min,Cloudy with a Chance of Meatballs 2,movie,http://www.cloudy-movie.com/site/,"Erica Rivinoja (screenplay by), John Francis Daley (screenplay), Jonathan Goldstein (screenplay by), Phil Lord (story by), Christopher Miller (story by), Erica Rivinoja (story by), Judi Barrett (inspired by the book ""Cloudy with a Chance of Meatballs"" written by), Ron Barrett (inspired by the book ""Cloudy with a Chance of Meatballs"" illustrated by)",2013,tt1985966,6.4,"79,523",
427,"Jennifer Aniston, Jason Sudeikis, Emma Roberts, Will Poulter",4 wins & 15 nominations.,"$144,900,000",USA,19 Nov 2013,Rawson Marshall Thurber,,"Comedy, Crime","English, Spanish",44,A veteran pot dealer creates a fake family as part of his plan to move a huge shipment of weed into the U.S. from Mexico.,https://m.media-amazon.com/images/M/MV5BMjA5Njc0NDUxNV5BMl5BanBnXkFtZTcwMjYzNzU1OQ@@._V1_SX300.jpg,Warner Bros. Pictures,R,"[{'Source': 'Internet Movie Database', 'Value': '7.0/10'}, {'Source': 'Rotten Tomatoes', 'Value': '48%'}, {'Source': 'Metacritic', 'Value': '44/100'}]",07 Aug 2013,True,110 min,We're the Millers,movie,http://www.werethemillers.com,"Bob Fisher (screenplay), Steve Faber (screenplay), Sean Anders (screenplay), John Morris (screenplay), Bob Fisher (story), Steve Faber (story)",2013,tt1723121,7.0,"367,316",
428,"Blake Anderson, Aziz Ansari, Allison Bills, Jim Conroy",2 wins & 21 nominations.,"$107,515,297",USA,20 Sep 2013,Chris Wedge,,"Animation, Adventure, Family, Fantasy, Thriller",English,52,A teenager finds herself transported to a deep forest setting where a battle between the forces of good and the forces of evil is taking place. She bands together with a rag-tag group of characters in order to save their world -- and ours.,https://m.media-amazon.com/images/M/MV5BMTgyNDYwNzE5NV5BMl5BanBnXkFtZTcwMzUyODM5OA@@._V1_SX300.jpg,Twentieth Century Fox,PG,"[{'Source': 'Internet Movie Database', 'Value': '6.7/10'}, {'Source': 'Rotten Tomatoes', 'Value': '65%'}, {'Source': 'Metacritic', 'Value': '52/100'}]",24 May 2013,True,102 min,Epic,movie,http://www.epicthemovie.com/,"James V. Hart (screenplay), William Joyce (screenplay), Daniel Shere (screenplay), Tom J. Astle (screenplay), Matt Ember (screenplay), William Joyce (story), James V. Hart (story), Chris Wedge (story), William Joyce (Leafmen characters from book ""The Leaf Men and the Brave Good Bugs"")",2013,tt0848537,6.7,"94,632",
429,"Johnny Depp, Armie Hammer, William Fichtner, Tom Wilkinson",Nominated for 2 Oscars. Another 4 wins & 17 nominations.,"$89,289,910",USA,17 Dec 2013,Gore Verbinski,,"Action, Adventure, Western","English, North American Indian",37,"Native American warrior Tonto recounts the untold tales that transformed John Reid, a man of the law, into a legend of justice.",https://m.media-amazon.com/images/M/MV5BZjFiMTc2MTAtZDA0My00OGRmLTk5M2ItNTlmYTUwZmU2YmRiXkEyXkFqcGdeQXVyNTIzOTk5ODM@._V1_SX300.jpg,Walt Disney Pictures,PG-13,"[{'Source': 'Internet Movie Database', 'Value': '6.4/10'}, {'Source': 'Rotten Tomatoes', 'Value': '31%'}, {'Source': 'Metacritic', 'Value': '37/100'}]",03 Jul 2013,True,150 min,The Lone Ranger,movie,http://disney.go.com/the-lone-ranger/,"Justin Haythe (screenplay), Ted Elliott (screenplay), Terry Rossio (screenplay), Ted Elliott (screen story), Terry Rossio (screen story), Justin Haythe (screen story)",2013,tt1210819,6.4,"206,736",
430,"Christian Bale, Bradley Cooper, Amy Adams, Jeremy Renner",Nominated for 10 Oscars. Another 70 wins & 208 nominations.,"$99,165,609",USA,18 Mar 2014,David O. Russell,,"Crime, Drama","English, Arabic",90,"A con man, Irving Rosenfeld, along with his seductive partner Sydney Prosser, is forced to work for a wild F.B.I. Agent, Richie DiMaso, who pushes them into a world of Jersey powerbrokers and the Mafia.",https://m.media-amazon.com/images/M/MV5BMmM4YzJjZGMtNjQxMy00NjdlLWJjYTItZWZkYzdhOTdhNzFiXkEyXkFqcGdeQXVyMTMxODk2OTU@._V1_SX300.jpg,Sony Pictures,R,"[{'Source': 'Internet Movie Database', 'Value': '7.2/10'}, {'Source': 'Rotten Tomatoes', 'Value': '92%'}, {'Source': 'Metacritic', 'Value': '90/100'}]",20 Dec 2013,True,138 min,American Hustle,movie,http://www.americanhustle-movie.com/,"Eric Warren Singer, David O. Russell",2013,tt1800241,7.2,"414,678",
431,"Adam Sandler, Kevin James, Chris Rock, David Spade",5 wins & 15 nominations.,"$127,400,000",USA,05 Nov 2013,Dennis Dugan,,Comedy,"English, Spanish",19,"After moving his family back to his hometown to be with his friends and their kids, Lenny finds out that between old bullies, new bullies, schizo bus drivers, drunk cops on skis, and four hundred costumed party crashers sometimes crazy follows you.",https://m.media-amazon.com/images/M/MV5BMTgwNTI2MDI0OF5BMl5BanBnXkFtZTcwMTk5MDg0OQ@@._V1_SX300.jpg,Sony Pictures,PG-13,"[{'Source': 'Internet Movie Database', 'Value': '5.4/10'}, {'Source': 'Rotten Tomatoes', 'Value': '7%'}, {'Source': 'Metacritic', 'Value': '19/100'}]",12 Jul 2013,True,101 min,Grown Ups 2,movie,http://www.GrownUps2-Movie.com/,"Fred Wolf, Adam Sandler, Tim Herlihy, Adam Sandler (based on characters created by), Fred Wolf (based on characters created by)",2013,tt2191701,5.4,"127,094",
432,"Jaden Smith, Will Smith, Sophie Okonedo, Zoë Kravitz",3 wins & 8 nominations.,"$60,522,097",USA,08 Oct 2013,M. Night Shyamalan,,"Action, Adventure, Sci-Fi",English,33,"A crash landing leaves Kitai Raige and his father Cypher stranded on Earth, a millennium after events forced humanity's escape. With Cypher injured, Kitai must embark on a perilous journey to signal for help.",https://m.media-amazon.com/images/M/MV5BMTY3MzQyMjkwMl5BMl5BanBnXkFtZTcwMDk2OTE0OQ@@._V1_SX300.jpg,Sony Pictures,PG-13,"[{'Source': 'Internet Movie Database', 'Value': '4.8/10'}, {'Source': 'Rotten Tomatoes', 'Value': '11%'}, {'Source': 'Metacritic', 'Value': '33/100'}]",31 May 2013,True,100 min,After Earth,movie,http://afterearth.com/,"Gary Whitta (screenplay), M. Night Shyamalan (screenplay), Will Smith (story)",2013,tt1815862,4.8,"180,278",
433,"Dane Cook, Stacy Keach, Brad Garrett, Teri Hatcher",5 nominations.,"$71,270,759",USA,19 Nov 2013,Klay Hall,,"Animation, Adventure, Comedy, Family","English, Spanish",39,A cropdusting plane with a fear of heights lives his dream of competing in a famous around-the-world aerial race.,https://m.media-amazon.com/images/M/MV5BMjAwODc5NzYzOF5BMl5BanBnXkFtZTcwNTk4MjEzOQ@@._V1_SX300.jpg,Walt Disney Pictures,PG,"[{'Source': 'Internet Movie Database', 'Value': '5.7/10'}, {'Source': 'Rotten Tomatoes', 'Value': '25%'}, {'Source': 'Metacritic', 'Value': '39/100'}]",09 Aug 2013,True,91 min,Planes,movie,http://www.disney.com/planes,"John Lasseter (original story by), Klay Hall (original story by), Jeffrey M. Howard (original story by), Jeffrey M. Howard (screenplay by), Roberts Gannaway (additional story material), Jon Cryer (additional story material)",2013,tt1691917,5.7,"39,539",
434,"Sandra Bullock, Melissa McCarthy, Demián Bichir, Marlon Wayans",7 wins & 16 nominations.,"$158,300,000",USA,15 Oct 2013,Paul Feig,,"Action, Comedy, Crime","English, Spanish, Bulgarian",60,An uptight FBI Special Agent is paired with a foul-mouthed Boston cop to take down a ruthless drug lord.,https://m.media-amazon.com/images/M/MV5BMjA2MDQ2ODM3MV5BMl5BanBnXkFtZTcwNDUzMTQ3OQ@@._V1_SX300.jpg,20th Century Fox,R,"[{'Source': 'Internet Movie Database', 'Value': '6.6/10'}, {'Source': 'Rotten Tomatoes', 'Value': '65%'}, {'Source': 'Metacritic', 'Value': '60/100'}]",28 Jun 2013,True,117 min,The Heat,movie,http://www.theheatmovie.com/#/trailer,Katie Dippold,2013,tt2404463,6.6,"152,439",
435,"Jeremy Renner, Gemma Arterton, Famke Janssen, Pihla Viitala",3 wins & 4 nominations.,"$55,000,000","Germany, USA",11 Jun 2013,Tommy Wirkola,,"Action, Fantasy, Horror",English,23,"Hansel & Gretel are bounty hunters who track and kill witches all over the world. As the fabled Blood Moon approaches, the siblings encounter a new form of evil that might hold a secret to their past.",https://m.media-amazon.com/images/M/MV5BMjA4MDQwODg2NV5BMl5BanBnXkFtZTcwNTc5ODc2OA@@._V1_SX300.jpg,Paramount Pictures/MGM,R,"[{'Source': 'Internet Movie Database', 'Value': '6.1/10'}, {'Source': 'Rotten Tomatoes', 'Value': '15%'}, {'Source': 'Metacritic', 'Value': '23/100'}]",25 Jan 2013,True,88 min,Hansel & Gretel: Witch Hunters,movie,http://www.hanselandgretelmovie.com/,Tommy Wirkola,2013,tt1428538,6.1,"181,220",
436,"Tom Hanks, Catherine Keener, Barkhad Abdi, Barkhad Abdirahman",Nominated for 6 Oscars. Another 16 wins & 144 nominations.,"$107,100,855",USA,21 Jan 2014,Paul Greengrass,,"Biography, Drama, Thriller","English, Somali",83,"The true story of Captain Richard Phillips and the 2009 hijacking by Somali pirates of the U.S.-flagged MV Maersk Alabama, the first American cargo ship to be hijacked in two hundred years.",https://m.media-amazon.com/images/M/MV5BODhiZWRhMjctNDUyMS00NmUwLTgwYmItMjJhOWNkZWQ3ZTQxXkEyXkFqcGdeQXVyMTMxODk2OTU@._V1_SX300.jpg,Sony Pictures,PG-13,"[{'Source': 'Internet Movie Database', 'Value': '7.8/10'}, {'Source': 'Rotten Tomatoes', 'Value': '93%'}, {'Source': 'Metacritic', 'Value': '83/100'}]",11 Oct 2013,True,134 min,Captain Phillips,movie,http://www.captainphillipsmovie.com/,"Billy Ray (screenplay), Richard Phillips (based upon the book ""A Captain's Duty: Somali Pirates,  Navy SEALS,  and Dangerous Days at Sea"" by), Stephan Talty (based upon the book ""A Captain's Duty: Somali Pirates,  Navy SEALS,  and Dangerous Days at Sea"" by)",2013,tt1535109,7.8,"383,661",
437,"Channing Tatum, Jamie Foxx, Maggie Gyllenhaal, Jason Clarke",3 wins & 9 nominations.,"$73,103,784",USA,05 Nov 2013,Roland Emmerich,,"Action, Drama, Thriller",English,52,"While on a tour of the White House with his young daughter, a Capitol policeman springs into action to save his child and protect the president from a heavily armed group of paramilitary invaders.",https://m.media-amazon.com/images/M/MV5BMTAyNzQyNTcwNjVeQTJeQWpwZ15BbWU3MDAwOTQ4Nzk@._V1_SX300.jpg,Sony Pictures,PG-13,"[{'Source': 'Internet Movie Database', 'Value': '6.4/10'}, {'Source': 'Rotten Tomatoes', 'Value': '51%'}, {'Source': 'Metacritic', 'Value': '52/100'}]",28 Jun 2013,True,131 min,White House Down,movie,http://www.whitehousedown.com/,James Vanderbilt,2013,tt2334879,6.4,"190,056",
438,"Logan Lerman, Alexandra Daddario, Douglas Smith, Leven Rambin",3 wins & 5 nominations.,"$68,558,662",USA,17 Dec 2013,Thor Freudenthal,,"Adventure, Family, Fantasy, Thriller",English,39,"In order to restore their dying safe haven, the son of Poseidon and his friends embark on a quest to the Sea of Monsters, to find the mythical Golden Fleece, all the while trying to stop an ancient evil from rising.",https://m.media-amazon.com/images/M/MV5BYmE4MThmY2UtNDYxOC00YmFkLTg1NGEtMTQ3YTFmZjdhZmRiXkEyXkFqcGdeQXVyNjA3MDQ1NzY@._V1_SX300.jpg,20th Century Fox,PG,"[{'Source': 'Internet Movie Database', 'Value': '5.8/10'}, {'Source': 'Metacritic', 'Value': '39/100'}]",07 Aug 2013,True,106 min,Percy Jackson: Sea of Monsters,movie,http://www.percyjacksonthemovie.com,"Marc Guggenheim (screenplay by), Rick Riordan (based upon the novel ""Percy Jackson and the Olympians: The Sea of Monsters"" written by)",2013,tt1854564,5.8,"101,068",
439,"Nicholas Hoult, Eleanor Tomlinson, Ewan McGregor, Stanley Tucci",1 win & 4 nominations.,"$65,171,860",USA,18 Jun 2013,Bryan Singer,,"Adventure, Fantasy",English,51,"The ancient war between humans and a race of giants is reignited when Jack, a young farmhand fighting for a kingdom and the love of a princess, opens a gateway between the two worlds.",https://m.media-amazon.com/images/M/MV5BMjE1NDMxMjI0OV5BMl5BanBnXkFtZTcwMjQyMDExOQ@@._V1_SX300.jpg,Warner Bros.,PG-13,"[{'Source': 'Internet Movie Database', 'Value': '6.3/10'}, {'Source': 'Rotten Tomatoes', 'Value': '52%'}, {'Source': 'Metacritic', 'Value': '51/100'}]",01 Mar 2013,True,114 min,Jack the Giant Slayer,movie,http://jackthegiantslayer.warnerbros.com/,"Darren Lemke (screenplay), Christopher McQuarrie (screenplay), Dan Studney (screenplay), Darren Lemke (story), David Dobkin (story)",2013,tt1351685,6.3,"121,701",
440,"Ben Stiller, Kristen Wiig, Jon Daly, Kathryn Hahn",5 wins & 18 nominations.,"$33,223,430","USA, UK",15 Apr 2014,Ben Stiller,,"Adventure, Comedy, Drama, Fantasy, Romance","English, Spanish, Icelandic",54,"When his job along with that of his co-worker are threatened, Walter takes action in the real world embarking on a global journey that turns into an adventure more extraordinary than anything he could have ever imagined.",https://m.media-amazon.com/images/M/MV5BODYwNDYxNDk1Nl5BMl5BanBnXkFtZTgwOTAwMTk2MDE@._V1_SX300.jpg,20th Century Fox,PG,"[{'Source': 'Internet Movie Database', 'Value': '7.3/10'}, {'Source': 'Rotten Tomatoes', 'Value': '51%'}, {'Source': 'Metacritic', 'Value': '54/100'}]",25 Dec 2013,True,114 min,The Secret Life of Walter Mitty,movie,http://WalterMitty.com,"Steve Conrad (screenplay by), Steve Conrad (screen story by), James Thurber (based on the short story by)",2013,tt0359950,7.3,"273,096",
441,"Chiwetel Ejiofor, Dwight Henry, Dickie Gravois, Bryan Batt",Won 3 Oscars. Another 235 wins & 326 nominations.,"$50,628,650","USA, UK",04 Mar 2014,Steve McQueen,,"Biography, Drama, History",English,96,"In the antebellum United States, Solomon Northup, a free black man from upstate New York, is abducted and sold into slavery.",https://m.media-amazon.com/images/M/MV5BMjExMTEzODkyN15BMl5BanBnXkFtZTcwNTU4NTc4OQ@@._V1_SX300.jpg,Fox Searchlight,R,"[{'Source': 'Internet Movie Database', 'Value': '8.1/10'}, {'Source': 'Rotten Tomatoes', 'Value': '95%'}, {'Source': 'Metacritic', 'Value': '96/100'}]",08 Nov 2013,True,134 min,12 Years a Slave,movie,http://www.foxsearchlight.com/12yearsaslave/,"John Ridley (screenplay by), Solomon Northup (based on ""Twelve Years a Slave"" by)",2013,tt2024544,8.1,"567,936",
